{
  "$schema": "./schema/register.schema.json",
  "openrepos.io": {},
  "openrepos.org": {
    "kubecell": {
      "repo": "https://github.com/taosher/KubeCell",
      "target": "kubecell.pages.dev"
    }
  },
  "openrepos.sh": {},
  "repos.one": {},
  "sourcepage.io": {},
  "sourcepage.org": {},
  "sourcepage.sh": {}
}
